<?xml version="1.0" encoding="UTF-8"?>
<domotic xmlns="http://dlvmechanografie.eu/DomoticConfig"
	xmlns:xsi="http://www.w3.org/2001/XMLSchema-instance"
	xsi:schemaLocation="http://dlvmechanografie.eu/DomoticConfig ../../../DomoticConfig.xsd ">

	<switch channel="5" name="SchakAllOnOff" desc="Alle lichten aan/uit." />

	<repeatOff name="GarageAutoUit" desc="test repeat off"
		intervalSec="60">
		<on hour="21" minute="0" />
		<off hour="21" minute="15" />
	</repeatOff>

	<switch channel="1" name="SchakLichtBadkamer0" desc="Licht badkamer gelijkvloers." />
	<lamp channel="3" name="LichtBadkamer0">
		<toggle src="SchakLichtBadkamer0" event="SingleClick" />
		<off src="SchakAllOnOff" event="LongClick" />
		<off src="GarageAutoUit" event="Off" />
	</lamp>

	<switch channel="10" name="SchakFanBadkamer0" />
	<fan name="FanBadkamer0" channel="6">
		<toggle src="SchakFanBadkamer0" event="SingleClick" />
		<off src="SchakFanBadkamer0" event="LongClick" />
		<delayedOnOff src="LichtBadkamer0" />
	</fan>

	<switch channel="2" name="SchakLichtWC0" desc="Licht badkamer boven." />
	<lamp channel="4" name="LichtWC0">
		<toggle src="SchakLichtWC0" event="SingleClick" />
		<off src="SchakAllOnOff" event="LongClick" />
	</lamp>

	<switch channel="11" name="SchakFanWC0" />
	<fan name="FanWC0" channel="7" desc="Ventilator WC gelijkvloers.">
		<toggle src="SchakFanWC0" event="SingleClick" />
		<off src="SchakFanWC0" event="LongClick" />
		<delayedOnOff src="LichtWC0" />
	</fan>

	<!-- Dimmers -->
	<dimmerSwitches name="SchakLichtVeranda" />
	<dimmedLamp name="LichtVeranda" fullOnHwOutput="4095" desc="Veranda" ui="Beneden:1">
		<dimmerSwitches src="SchakLichtVeranda"/>
		<off src="SchakAllOnOff" event="LongClick" />
	</dimmedLamp>


	<!-- Screens -->
	<switch name="SchakScreenBreedUp" />
	<switch name="SchakScreenBreedDown" />
	<switch name="SchakScreenLangUp" />
	<switch name="SchakScreenLangDown" />
	<switch name="SchakScreenAllUp" singleClick="true" longClick="true" />
	<switch name="SchakScreenAllDown" singleClick="true" longClick="true" />

	<screen name="ScreenBreed" desc="Breed" motor-up-time="40"
		motor-dn-time="36">
		<upDown srcUp="SchakScreenBreedUp" srcDown="SchakScreenBreedDown" />
		<upDown srcUp="SchakScreenAllUp" srcDown="SchakScreenAllDown"
			event="LongClick" />
	</screen>
	<screen name="ScreenLang" desc="Smal" motor-up-time="100"
		motor-dn-time="100">
		<upDown srcUp="SchakScreenLangUp" srcDown="SchakScreenLangDown" />
		<upDown srcUp="SchakScreenAllUp" srcDown="SchakScreenAllDown"
			event="LongClick" />
	</screen>

	<windSensor name="Windmeter" channel="Windmeter" highFreq="5"
		lowFreq="2" lowTimeToResetAlert="60" />
	<lightGauge name="LichtsensorScreen" channel="AnalogIn"
		threshold="3000" low2highTime="10" high2lowTime="60" />


	<sunWindController name="ZonWindAutomaat" desc="Zon/Wind Automaat"
		ui="Screens:0">
		<!-- TODO zon en wind, afhankelijk van groep andere parameters rond lichtsterkte, 
			ook rekening houdende met zonnestand. Dus hier moeten groepen kunnen gedefinieerd 
			worden, met verschillende parameters, b.v. ook alarm etc. moeten hier bij 
			wind en sun. -->
		<wind sensor="Windmeter" />
		<sun sensor="LichtsensorScreen" />
		<screen name="ScreenBreed" />
		<screen name="ScreenLang" />
	</sunWindController>


	<lightGauge name="LichtsensorNacht" threshold="4000"
		low2highTime="10" high2lowTime="60" channel="AnalogIn" />

	<lamp name="indicator">
		<on src="LichtsensorNacht" event="ALARM" />
		<off src="LichtsensorNacht" event="SAFE" />
	</lamp>

</domotic>
